[
  {
    "confidence": "weak",
    "evidence_quote": "Budgeting and Forecasting are done case by case, and approvals for spend-impacting changes are informal. Cost and usage visibility is inconsistent and often relies on manual reporting.",
    "from": "architecting-workload-placement",
    "heuristic": "title-mention",
    "rationale": "The architecting-workload-placement crawl assessment text names budgeting explicitly (no direction implied).",
    "source": "inferred",
    "to": "budgeting",
    "type": "related"
  },
  {
    "confidence": "weak",
    "evidence_quote": "Budgeting and Forecasting are done case by case, and approvals for spend-impacting changes are informal. Cost and usage visibility is inconsistent and often relies on manual reporting.",
    "from": "architecting-workload-placement",
    "heuristic": "title-mention",
    "rationale": "The architecting-workload-placement crawl assessment text names forecasting explicitly (no direction implied).",
    "source": "inferred",
    "to": "forecasting",
    "type": "related"
  },
  {
    "confidence": "weak",
    "evidence_quote": "Identified sources of utilization data, carbon data, internal metadata required to support Allocation and Analytics & Reporting",
    "from": "allocation",
    "heuristic": "title-mention",
    "rationale": "The data-ingestion crawl assessment text names allocation explicitly (no direction implied).",
    "source": "inferred",
    "to": "data-ingestion",
    "type": "related"
  },
  {
    "confidence": "weak",
    "evidence_quote": "Business outcomes and unit metrics improve within Scopes, with early Unit Economics and Forecasting tied to demand signals.",
    "from": "executive-strategy-alignment",
    "heuristic": "title-mention",
    "rationale": "The executive-strategy-alignment walk assessment text names forecasting explicitly (no direction implied).",
    "source": "inferred",
    "to": "forecasting",
    "type": "related"
  },
  {
    "confidence": "weak",
    "evidence_quote": "Business outcomes and unit metrics improve within Scopes, with early Unit Economics and Forecasting tied to demand signals.",
    "from": "executive-strategy-alignment",
    "heuristic": "title-mention",
    "rationale": "The executive-strategy-alignment walk assessment text names unit-economics explicitly (no direction implied).",
    "source": "inferred",
    "to": "unit-economics",
    "type": "related"
  },
  {
    "confidence": "weak",
    "evidence_quote": "Covers basic FinOps processes and principles, such as Metadata & Account Organization, Cost Allocation, Ownership & Accountability",
    "from": "allocation",
    "heuristic": "title-mention",
    "rationale": "The finops-education-enablement crawl assessment text names allocation explicitly (no direction implied).",
    "source": "inferred",
    "to": "finops-education-enablement",
    "type": "related"
  },
  {
    "confidence": "weak",
    "evidence_quote": "Education is generally directed towards Usage Optimization and Rate Optimization as the main vehicles for improving business value",
    "from": "finops-education-enablement",
    "heuristic": "title-mention",
    "rationale": "The finops-education-enablement crawl assessment text names rate-optimization explicitly (no direction implied).",
    "source": "inferred",
    "to": "rate-optimization",
    "type": "related"
  },
  {
    "confidence": "weak",
    "evidence_quote": "Education is generally directed towards Usage Optimization and Rate Optimization as the main vehicles for improving business value",
    "from": "finops-education-enablement",
    "heuristic": "title-mention",
    "rationale": "The finops-education-enablement crawl assessment text names usage-optimization explicitly (no direction implied).",
    "source": "inferred",
    "to": "usage-optimization",
    "type": "related"
  },
  {
    "confidence": "weak",
    "evidence_quote": "Covers a broader range of FinOps processes and practices, such as Forecasting, Managing shared costs, Budget Management and Environmental Impact",
    "from": "finops-education-enablement",
    "heuristic": "title-mention",
    "rationale": "The finops-education-enablement walk assessment text names forecasting explicitly (no direction implied).",
    "source": "inferred",
    "to": "forecasting",
    "type": "related"
  },
  {
    "confidence": "weak",
    "evidence_quote": "Forecast is inclusive of rate optimization and commitment-based discounts",
    "from": "forecasting",
    "heuristic": "title-mention",
    "rationale": "The forecasting walk assessment text names rate-optimization explicitly (no direction implied).",
    "source": "inferred",
    "to": "rate-optimization",
    "type": "related"
  },
  {
    "confidence": "weak",
    "evidence_quote": "Forecast is inclusive of usage optimization opportunities",
    "from": "forecasting",
    "heuristic": "title-mention",
    "rationale": "The forecasting run assessment text names usage-optimization explicitly (no direction implied).",
    "source": "inferred",
    "to": "usage-optimization",
    "type": "related"
  },
  {
    "confidence": "weak",
    "evidence_quote": "Forecasting is updated to include software costs to reflect the total cost of a service/application",
    "from": "forecasting",
    "heuristic": "title-mention",
    "rationale": "The licensing-saas walk assessment text names forecasting explicitly (no direction implied).",
    "source": "inferred",
    "to": "licensing-saas",
    "type": "related"
  },
  {
    "confidence": "weak",
    "evidence_quote": "Estimates are inclusive of cloud rate optimization, commitment-based discounts and carbon targets",
    "from": "planning-estimating",
    "heuristic": "title-mention",
    "rationale": "The planning-estimating walk assessment text names rate-optimization explicitly (no direction implied).",
    "source": "inferred",
    "to": "rate-optimization",
    "type": "related"
  },
  {
    "confidence": "weak",
    "evidence_quote": "Estimating scenarios support rolling, trend-based and driver-based Forecasting capability",
    "from": "forecasting",
    "heuristic": "title-mention",
    "rationale": "The planning-estimating run assessment text names forecasting explicitly (no direction implied).",
    "source": "inferred",
    "to": "planning-estimating",
    "type": "related"
  },
  {
    "confidence": "weak",
    "evidence_quote": "Incorporation of Licensing & SaaS, Sustainability, and Architecting guidance when making rate optimization decisions",
    "from": "rate-optimization",
    "heuristic": "title-mention",
    "rationale": "The rate-optimization run assessment text names sustainability explicitly (no direction implied).",
    "source": "inferred",
    "to": "sustainability",
    "type": "related"
  },
  {
    "confidence": "weak",
    "evidence_quote": "Sustainability metrics are fully embedded into allocation, chargeback, and unit economics models, enabling teams to track and be accountable for their carbon footprint alongside their technology spend in a consistent and repeatable way",
    "from": "sustainability",
    "heuristic": "title-mention",
    "rationale": "The sustainability run assessment text names unit-economics explicitly (no direction implied).",
    "source": "inferred",
    "to": "unit-economics",
    "type": "related"
  },
  {
    "confidence": "weak",
    "evidence_quote": "A comprehensive usage optimization strategy is in place that provides clear guidance across all usage types and FinOps Scopes, defines multiple approaches to addressing waste and inefficiency, sets specific optimization expectations for …",
    "from": "sustainability",
    "heuristic": "title-mention",
    "rationale": "The usage-optimization run assessment text names sustainability explicitly (no direction implied).",
    "source": "inferred",
    "to": "usage-optimization",
    "type": "related"
  },
  {
    "confidence": "weak",
    "evidence_quote": "Sustainability efficiency where measurable (for example emissions or energy intensity per unit of work)",
    "from": "architecting-workload-placement",
    "heuristic": "title-mention",
    "rationale": "The architecting-workload-placement KPI bullets text names sustainability explicitly (no direction implied).",
    "source": "inferred",
    "to": "sustainability",
    "type": "related"
  },
  {
    "confidence": "weak",
    "evidence_quote": "Architecting products and services to support publishing information related to their unit economics",
    "from": "reporting-analytics",
    "heuristic": "title-mention",
    "rationale": "The reporting-analytics KPI bullets text names unit-economics explicitly (no direction implied).",
    "source": "inferred",
    "to": "unit-economics",
    "type": "related"
  },
  {
    "confidence": "weak",
    "evidence_quote": "Unit Economics KPIs are defined and tracked to measure the efficiency of technology usage relative to meaningful units of business value including cost, compute consumption, or carbon emissions per customer, transaction, or other relevan…",
    "from": "unit-economics",
    "heuristic": "title-mention",
    "rationale": "The usage-optimization KPI bullets text names unit-economics explicitly (no direction implied).",
    "source": "inferred",
    "to": "usage-optimization",
    "type": "related"
  }
]
